{
  "$schema": "../../schema/hoikuryo.schema.json",
  "id": "tokyo-chiyoda",
  "name": "東京都千代田区",
  "municipalityCode": "131016",
  "prefecture": "東京都",
  "municipalityType": "特別区",
  "fiscalYear": 2026,
  "asOf": "2026-07-17",
  "sources": [
    {
      "id": "chiyoda-hoikuryo-page",
      "title": "認可保育園・こども園の保育料",
      "publisher": "千代田区 教育委員会事務局子ども部子ども支援課入園審査係",
      "url": "https://www.city.chiyoda.lg.jp/koho/kosodate/hoiku/hoikuryo.html",
      "contentType": "html",
      "checkedAt": "2026-07-17",
      "tier": "municipality",
      "note": "更新日2025年11月5日。「お子さんの年齢やきょうだいの有無、保護者の所得にかかわらず基本保育料は無償です。」と明記。所得階層別の保育料表の掲載は一切なし。「世帯階層の決定について」の項に、無償化の財源(国・東京都の補助金)を区が受け取るための手続きとして世帯の課税状況に応じた階層決定を行う旨と、その税年度の切替ルールのみが記載されている(階層の境界額は非公表)。"
    },
    {
      "id": "chiyoda-annai-r8",
      "title": "令和8年度保育園・こども園の入園案内(令和8年4月改訂)",
      "publisher": "千代田区 教育委員会事務局子ども部子ども支援課",
      "url": "https://www.city.chiyoda.lg.jp/documents/32102/r804nyuenannai.pdf",
      "landingUrl": "https://www.city.chiyoda.lg.jp/koho/kosodate/hoiku/nyuenannai.html",
      "contentType": "pdf",
      "checkedAt": "2026-07-17",
      "tier": "municipality",
      "note": "全113ページ。PDF内部プロパティのタイトルが「令和8年度保育園・こども園の入園案内(令和8年4月改訂）」、作成日2026-04-13。P.39「1 保育料」に「令和７年９月利用分から、お子さんの年齢やきょうだいの有無、保護者の所得にかかわらず、認可保育園等の基本保育料は無料となりました。」。P.41〜43【表８】は月極延長保育料の階層表(Ａ・Ｂ・Ｃ・Ｄ１〜Ｄ２１)であり、基本保育料の階層表ではない。P.108のQ&Aに「基本保育料は一律無料です」と明記。"
    },
    {
      "id": "chiyoda-encho-page",
      "title": "保育園・こども園等延長保育料",
      "publisher": "千代田区 教育委員会事務局子ども部子ども支援課入園審査係",
      "url": "https://www.city.chiyoda.lg.jp/koho/kosodate/hoiku/encho.html",
      "contentType": "html",
      "checkedAt": "2026-07-17",
      "tier": "municipality",
      "note": "更新日2025年11月11日。延長保育料の階層算定に用いる「区市町村民税所得割相当額」の定義(適用しない税額控除の列挙)と税年度の切替ルールを掲載。区が公表している所得割額の階層区分は、この延長保育料用のもののみ。"
    }
  ],
  "amendments": [
    {
      "summary": "令和7年9月利用分より、東京都の第1子保育料無償化にあわせて千代田区は認可保育所・区立こども園・認定こども園・地域型保育事業に在籍する児童の基本保育料を、年齢・きょうだいの有無・保護者の所得にかかわらず無償化。2026-07-17時点で有効。",
      "status": "in-force",
      "effectiveFrom": "2025-09-01",
      "sourceId": "chiyoda-hoikuryo-page",
      "impact": "全所得帯の基本保育料は0円。無償化のための特別な手続きは不要。ただし延長保育料は無償化・減免の対象外で階層別に発生するため、階層判定ロジック自体は引き続き必要。"
    },
    {
      "summary": "全児童無償化に伴い、千代田区は基本保育料の所得階層別金額表を公表していない。区ホームページ「認可保育園・こども園の保育料」および令和8年度入園案内(全113ページ)のいずれにも、基本保育料の階層区分(所得割額の境界)の記載がない。区は補助金申請のために世帯階層の決定を継続しているが、その階層の境界額は2026-07-17時点で公表資料から取得不能。",
      "status": "under-review",
      "sourceId": "chiyoda-hoikuryo-page",
      "impact": "tiers は所得階層で区分できず、全所得帯を1行(0円)で表現している。推測での階層補完は行っていない。区が階層表を再公表した場合、または有料に戻る場合は要更新。なお区が公表している唯一の所得割額の階層区分は延長保育料用(Ａ・Ｂ・Ｃ・Ｄ１〜Ｄ２１、平成27年4月1日/令和元年10月1日以降適用)であり、基本保育料の階層と同一である保証はないため tiers には転用していない。"
    }
  ],
  "disclaimer": "本データは千代田区公式サイトおよび令和8年度入園案内の公表内容を2026-07-17時点で機械的に整理したものです。千代田区は令和7年9月利用分以降、認可保育園等の基本保育料を所得にかかわらず無償としており、所得階層別の保育料表を公表していません。制度改正や個別事情により内容が異なる場合がありますので、必ず千代田区子ども支援課入園審査係にご確認ください。",
  "scope": {
    "includes": [
      "認可保育所(区立・私立)の基本保育料",
      "区立こども園・認定こども園(保育認定枠)の基本保育料",
      "地域型保育事業(小規模保育事業・事業所内保育事業・居宅訪問型保育事業)の基本保育料",
      "幼保一体施設内幼稚園(長時間クラス)の基本保育料"
    ],
    "excludes": [
      "給食費(主食費・副食費) ※認可保育園等では基本保育料に含まれ別途徴収はないが、本表の対象外。区外の保育園・幼稚園等に通う場合の副食費は区の助成制度による",
      "延長保育料 ※無償化の対象は基本保育料のみで、延長保育料は無償化の対象とならず減免もない。区立認可保育園・区立こども園・幼保一体施設内幼稚園は階層別月額(Ａ〜Ｄ２１)、私立認可保育園・認定こども園・地域型保育事業は所得にかかわらず各施設の設定額",
      "スポット延長保育料",
      "教材費・行事費等の実費徴収、私立園の上乗せ徴収・特定負担額",
      "認証保育所・幼保一体施設内保育園・区補助対象保育室の保育料 ※認可外施設であり、認証保育所等保育料減額補助認定を受けた場合に限り月220時間までの基本保育料が0円になる。入園料21,000円等は別",
      "認可外保育施設・幼稚園の保育料および補助",
      "千代田区外に在住で区内認可保育園等を利用する児童の保育料(居住自治体の制度による)"
    ]
  },
  "bracketBasis": {
    "basis": "市町村民税所得割額",
    "householdScope": "未確認: 基本保育料が全児童無償化されたため、令和8年度の公表資料に基本保育料の階層決定における合算対象世帯範囲の規定がない。参考として、延長保育料の階層は原典表記で「保護者（父母ともに）の、『区市町村民税所得割相当額』により、算定しています。」とされている。",
    "taxYearRule": "世帯の階層は、4月～8月利用分については前年度の区市町村民税所得割相当額、9月～翌年3月利用分については当年度の区市町村民税所得割相当額に応じて決定しています(原典「認可保育園・こども園の保育料」)。同一の切替ルールが延長保育料にも適用され、令和8年度は4〜8月分が令和7年度、9月〜令和9年3月分が令和8年度の区市町村民税所得割相当額となる。年度途中で延長保育の利用を開始した場合はその都度算定を実施する。",
    "deductionsIgnored": [
      "配当控除",
      "外国税額控除",
      "住宅取得控除",
      "寄付金控除",
      "配当割額控除",
      "株式等譲渡所得割額控除"
    ],
    "note": "★重要★ 千代田区は基本保育料の階層表(所得割額の境界)を公表していない。区が公表している唯一の階層区分は延長保育料用であり、その原典表記は「上記資料内の階層は、保護者（父母ともに）の、「区市町村民税所得割相当額」により、算定しています。所得割額の算定には配当控除、外国税額控除、住宅取得控除、寄付金控除、配当割額控除、株式等譲渡所得割額控除等の税額控除は適用しません。」。deductionsIgnored はこの延長保育料用の規定に基づく。参考値として区立認可保育園の延長保育料の階層境界は Ａ=生活保護世帯 / Ｂ=特別区民税非課税世帯 / Ｃ=特別区民税均等割額のみ / Ｄ１=所得割額47,700円未満 / Ｄ２=58,200円未満 / Ｄ３=68,000円未満 / Ｄ４=90,600円未満 / Ｄ５=113,000円未満 / Ｄ６=135,600円未満 / Ｄ７=158,000円未満 / Ｄ８=180,600円未満 / Ｄ９=203,100円未満 / Ｄ１０=225,600円未満 / Ｄ１１=245,800円未満 / Ｄ１２=257,100円未満 / Ｄ１３=268,300円未満 / Ｄ１４=279,600円未満 / Ｄ１５=290,800円未満 / Ｄ１６=302,100円未満 / Ｄ１７=313,300円未満 / Ｄ１８=369,600円未満 / Ｄ１９=425,800円未満 / Ｄ２０=482,000円未満 / Ｄ２１=482,000円以上（令和元年10月1日以降適用）。**この境界を基本保育料の階層として転用してはならない**（区は両者が同一である旨を公表していない）。所得割額の前処理について: 千代田区は特別区であり、政令指定都市のような税率調整(6/8換算等)は不要。税額控除前の所得割額から上記の税額控除を適用しない額を用いる。区は「住民税額シミュレーション」ページで参考額を把握できると案内している。海外から転入した場合は両親の所得額を基に決定し、4〜8月分は前々年の所得、9〜翌3月は前年の所得を基に決定する。"
  },
  "ageClasses": [
    {
      "key": "under3",
      "label": "3歳未満児(0〜2歳児クラス)",
      "rule": "未確認: 令和7年9月以降は年齢区分を問わず基本保育料が0円のため、基本保育料上の年齢区分・基準日の定義は令和8年度の公表資料にない。延長保育料の表では「１・２歳児クラス」「３歳児クラス」「４・５歳児クラス」の区分を用いる。"
    },
    {
      "key": "age3plus",
      "label": "3歳以上児(3〜5歳児クラス)",
      "rule": "国の幼児教育・保育の無償化により従前から無料。令和7年9月以降は全児童無償化に包含。"
    }
  ],
  "freeTuition": {
    "age3plusFree": {
      "value": true,
      "unit": "unit",
      "label": "3歳以上児の基本保育料は無償",
      "sourceId": "chiyoda-hoikuryo-page",
      "checkedAt": "2026-07-17",
      "verify": {
        "expect": [
          "お子さんの年齢やきょうだいの有無、保護者の所得にかかわらず基本保育料は無償です"
        ]
      },
      "amendmentNote": "なし(2026-07-17時点)",
      "note": "国の幼児教育・保育の無償化による。令和7年9月以降は年齢・所得によらない全児童無償化に包含。"
    },
    "under3NonTaxableFree": {
      "value": true,
      "unit": "unit",
      "label": "3歳未満の住民税非課税世帯も無償",
      "sourceId": "chiyoda-annai-r8",
      "checkedAt": "2026-07-17",
      "verify": {
        "expect": [
          "令和７年９月利用分から、お子さんの年齢やきょうだいの有無、保護者の所得にかかわらず、認可保育園等の基本保育料は無料となりました。"
        ]
      },
      "amendmentNote": "なし(2026-07-17時点)",
      "note": "非課税世帯に限らず、令和7年9月利用分以降は所得階層によらず3歳未満児(0〜2歳児クラス)の基本保育料も0円。"
    },
    "multiChildPolicy": {
      "countingRule": {
        "value": null,
        "unit": "unit",
        "label": "多子カウントの年齢上限(未確認)",
        "sourceId": "chiyoda-hoikuryo-page",
        "checkedAt": "2026-07-17",
        "amendmentNote": "なし(2026-07-17時点)",
        "note": "未確認: 千代田区は「きょうだいの有無…にかかわらず基本保育料は無償」としており、多子カウント(第何子か)による保育料軽減の規定が令和8年度の公表資料(区ホームページ・令和8年度入園案内 全113ページ)に存在しない。カウント方法の年齢上限は2026-07-17時点で公表資料から確認できず。"
      },
      "secondChild": {
        "value": 0,
        "unit": "JPY/month",
        "label": "第2子の基本保育料",
        "sourceId": "chiyoda-hoikuryo-page",
        "checkedAt": "2026-07-17",
        "amendmentNote": "なし(2026-07-17時点)",
        "note": "第1子を含む全児童が無償のため0円。東京都の第2子無償化(令和5年10月〜)は令和7年9月からの第1子無償化に包含され、区の資料では第2子固有の軽減規定として現れない。"
      },
      "thirdChildOnwards": {
        "value": 0,
        "unit": "JPY/month",
        "label": "第3子以降の基本保育料",
        "sourceId": "chiyoda-hoikuryo-page",
        "checkedAt": "2026-07-17",
        "amendmentNote": "なし(2026-07-17時点)",
        "note": "第1子を含む全児童が無償のため0円。"
      }
    },
    "localExtension": "令和7年9月利用分より、東京都の第1子保育料無償化を受けて、千代田区は「お子さんの年齢やきょうだいの有無、保護者の所得にかかわらず基本保育料は無償」(原典表記)としている。対象は認可保育所・区立こども園・認定こども園・地域型保育事業・幼保一体施設内幼稚園(長時間クラス)で、無償化を受けるための特別な手続きは不要。区独自の上乗せとしては、(1) 認証保育所・幼保一体施設内保育園・区補助対象保育室(いずれも認可外)についても「千代田区保育料減額補助」により月220時間までの基本保育料を0円としている点(0〜2歳児クラスの課税世帯は国の施設等利用給付が使えないため区の減額補助のみで0円にしている)、(2) 区外の保育園・幼稚園等に通われた際の副食費を助成している点が該当する。延長保育料・一時預かり保育料・入園料(幼保一体施設内保育園は21,000円)は無償化の対象外。令和7年8月利用分以前の基本保育料は保護者負担であり、未納分は引き続き督促・催告の対象となる。千代田区以外に在住の場合の保育料は居住自治体の制度による。"
  },
  "tiers": [
    {
      "tier": "全階層(区分なし)",
      "label": "千代田区民が認可保育所等(認可保育所・区立こども園・認定こども園・地域型保育事業・幼保一体施設内幼稚園)を利用する場合、お子さんの年齢やきょうだいの有無、保護者の所得にかかわらず基本保育料は一律無料。千代田区は基本保育料の所得階層別金額表を公表していない。",
      "incomeMin": 0,
      "incomeMax": null,
      "fees": {
        "under3": {
          "standard": 0,
          "short": 0
        },
        "age3plus": {
          "standard": 0,
          "short": 0
        }
      }
    }
  ],
  "verify": {
    "expect": [
      "お子さんの年齢やきょうだいの有無、保護者の所得にかかわらず基本保育料は無償です"
    ]
  }
}
