{
  "$schema": "../../schema/hoikuryo.schema.json",
  "id": "tokyo-nerima",
  "name": "東京都練馬区",
  "municipalityCode": "131202",
  "prefecture": "東京都",
  "municipalityType": "特別区",
  "fiscalYear": 2026,
  "asOf": "2026-07-17",
  "sources": [
    {
      "id": "nerima-hoikuryo-page",
      "title": "認可保育園等の保育料・副食費について",
      "publisher": "練馬区 こども家庭部 保育課",
      "url": "https://www.city.nerima.tokyo.jp/kosodatekyoiku/kodomo/hoiku/hoikuen/zaien/hoikuryou/hoikuryou.html",
      "contentType": "html",
      "checkedAt": "2026-07-17",
      "tier": "municipality",
      "note": "「令和7年9月以降、すべての児童の基本保育料が無料になります。無償化に伴う新たな手続きは必要ありません。」と明記。2026-07-17時点で有効なページ。"
    },
    {
      "id": "nerima-ninka-zaien-r8",
      "title": "令和8年度(2026年度) 認可保育園 在園ハンドブック",
      "publisher": "練馬区 保育課 保育認定係",
      "url": "https://www.city.nerima.tokyo.jp/kosodatekyoiku/kodomo/hoiku/hoikuen/zaien/zaihann.files/ninnka_zaienhandbookR8.pdf",
      "landingUrl": "https://www.city.nerima.tokyo.jp/kosodatekyoiku/kodomo/hoiku/hoikuen/zaien/zaihann.html",
      "contentType": "pdf",
      "checkedAt": "2026-07-17",
      "tier": "municipality",
      "note": "令和8年4月発行の令和8年度版。P.22「6 保育料」に「令和7年9月より、練馬区にお住まいのすべての児童の保育料は無料です。」と記載。所得階層表の掲載は一切なし。"
    },
    {
      "id": "nerima-annai-r8",
      "title": "【令和8年度】保育利用のご案内",
      "publisher": "練馬区 こども家庭部 保育課",
      "url": "https://www.city.nerima.tokyo.jp/kosodatekyoiku/kodomo/hoiku/hoikuen/nyuuen/moushikomi/siori-sisetu.files/R8_hoikuriyounogoannai02.pdf",
      "landingUrl": "https://www.city.nerima.tokyo.jp/kosodatekyoiku/kodomo/hoiku/hoikuen/nyuuen/moushikomi/siori-sisetu.html",
      "contentType": "pdf",
      "checkedAt": "2026-07-17",
      "tier": "municipality",
      "note": "令和8年度版(全58ページ)。P.4「第一子保育料の無償化が始まりました」、P.51「6 保育料 令和7年9月以降、すべての児童(注)の保育料が無料です。」。所得階層表の掲載なし。P.19に住民税(特別区民税所得割)の取扱いを記載。"
    }
  ],
  "amendments": [
    {
      "summary": "令和7年9月以降、第一子を含む練馬区在住のすべての児童の認可保育園等の基本保育料が無料(東京都の第1子保育料無償化に対応)。2026-07-17時点で有効。",
      "status": "in-force",
      "effectiveFrom": "2025-09-01",
      "sourceId": "nerima-hoikuryo-page",
      "impact": "所得階層に関わらず保育料は0円。無償化に伴う新たな手続きは不要。"
    },
    {
      "summary": "全児童無償化に伴い、練馬区は所得階層別の保育料表を廃止した。区ホームページの「保育料表」ページ(zaien/hoikuryou/hoikuryouhyou.html)は2026-07-17時点で削除済み(HTTP 404)であり、令和8年度版「保育利用のご案内」「在園ハンドブック」にも階層表の掲載がない。階層別金額は公表資料から取得不能。",
      "status": "under-review",
      "sourceId": "nerima-hoikuryo-page",
      "impact": "tiers は所得階層で区分できず、全所得帯を1行(0円)で表現している。スキーマの tiers minItems:2 を満たさない点に注意(全児童無償化により階層が存在しないため、推測での階層補完は行っていない)。区が階層表を再公表した場合は要更新。なお他区(世田谷・大田)は無償化後も延長保育料の算定基礎として階層表を公表し続けているが、練馬区の区立園の延長保育料は階層別ではなく利用時間帯別の定額(朝2,000円/夕1 4,000円/夕2 8,000円)のため階層表を必要としない。"
    }
  ],
  "disclaimer": "本データは練馬区公式サイトの公表内容を2026-07-17時点で機械的に整理したものです。練馬区は令和7年9月以降すべての児童の保育料を無料としており、所得階層別の保育料表を公表していません。制度改正や個別事情により内容が異なる場合がありますので、必ず練馬区保育課保育認定係にご確認ください。",
  "scope": {
    "includes": [
      "認可保育園の保育料(基本保育料・利用者負担額)",
      "地域型保育事業(小規模保育事業、家庭的保育事業、居宅訪問型事業、事業所内保育事業)の保育料",
      "認定こども園(2号利用)の保育料"
    ],
    "excludes": [
      "給食費(主食費・副食費)実費 ※練馬区に住所を有する世帯は区が全額負担するためかからないが、本表の対象外",
      "延長保育料 ※保護者負担。区立保育園は利用時間帯別の定額(朝7:00〜7:30 2,000円、夕1 18:30〜19:30 4,000円、夕2 18:30〜20:30 8,000円/月額)。生活保護受給世帯・住民税非課税世帯は免除",
      "園帽・行事費等の各園で独自に徴収している実費相当分",
      "認定こども園の特定負担額等",
      "年末保育(1人1日3,000円)・病児病後児保育(1日2,000円)等の利用料 ※無償化の対象事業ではない",
      "東京都外から通園する児童の保育料(居住自治体の制度による)",
      "認可外保育施設・認証保育所・幼稚園の保育料および助成"
    ]
  },
  "bracketBasis": {
    "basis": "市町村民税所得割額",
    "householdScope": "未確認: 保育料が全児童無償化されたため、練馬区は令和8年度の公表資料で保育料階層の合算対象世帯範囲を定めていない。なお利用調整(入園選考)の同一指数世帯の優先判定では、特別区民税(市町村民税)所得割が低額の世帯を優先する基準を用いる。",
    "taxYearRule": "未確認: 保育料階層自体が存在しないため、保育料についての税年度切替ルールは令和8年度の公表資料に記載がない。参考として、利用調整の優先判定に適用する特別区民税(市町村民税)所得割の年度は「令和8年8月入園の利用調整までは令和6年度、令和8年9月入園の利用調整からは令和7年度」で切り替わる(令和8年度「保育利用のご案内」)。",
    "deductionsIgnored": [
      "住宅借入金等特別税額控除",
      "寄付金税額控除",
      "配当控除"
    ],
    "note": "未確認: 保育料階層が廃止されたため、保育料算定における控除の取扱いを定めた規定は令和8年度の公表資料に存在しない。deductionsIgnored に挙げた控除は、令和8年度「保育利用のご案内」P.19「住民税について」に記載された、利用調整等のための特別区民税(市町村民税)所得割の算定ルール(住宅借入金等特別税額控除、寄付金税額控除、配当控除を適用しない)であり、保育料そのものの算定ルールではない点に注意。"
  },
  "ageClasses": [
    {
      "key": "under3",
      "label": "3歳未満児(0〜2歳児クラス)",
      "rule": "令和7年9月以降、年齢区分を問わず保育料は0円のため、練馬区の令和8年度公表資料に保育料上の年齢区分の定義はない。"
    },
    {
      "key": "age3plus",
      "label": "3歳以上児(3〜5歳児クラス)",
      "rule": "幼児教育・保育の無償化により従前から無料。認定こども園(2号利用)についても「幼児教育・保育の無償化により無料です」と明記(令和8年度 認定こども園 在園ハンドブック P.13)。"
    }
  ],
  "freeTuition": {
    "age3plusFree": {
      "value": true,
      "unit": "unit",
      "label": "3歳以上児の保育料は無償",
      "sourceId": "nerima-ninka-zaien-r8",
      "checkedAt": "2026-07-17",
      "amendmentNote": "なし(2026-07-17時点)",
      "note": "国の幼児教育・保育の無償化による。令和7年9月以降は全児童無償化に包含。"
    },
    "under3NonTaxableFree": {
      "value": true,
      "unit": "unit",
      "label": "3歳未満の住民税非課税世帯も無償",
      "sourceId": "nerima-ninka-zaien-r8",
      "checkedAt": "2026-07-17",
      "amendmentNote": "なし(2026-07-17時点)",
      "note": "非課税世帯に限らず、令和7年9月以降は所得階層によらず3歳未満児の保育料も0円。"
    },
    "multiChildPolicy": {
      "countingRule": {
        "value": null,
        "unit": "unit",
        "label": "多子カウントの年齢上限(未確認)",
        "sourceId": "nerima-annai-r8",
        "checkedAt": "2026-07-17",
        "amendmentNote": "なし(2026-07-17時点)",
        "note": "未確認: 練馬区は第一子を含む全児童の保育料を無償化したため、令和8年度の公表資料(「保育利用のご案内」「在園ハンドブック」「保育料・副食費ページ」)に多子カウントの年齢上限を定めた規定が存在しない。2026-07-17時点で公式資料から確認できず。"
      },
      "secondChild": {
        "value": 0,
        "unit": "JPY/month",
        "label": "第2子の保育料",
        "sourceId": "nerima-annai-r8",
        "checkedAt": "2026-07-17",
        "amendmentNote": "なし(2026-07-17時点)",
        "note": "第一子を含む全児童が無償のため0円。東京都の第2子無償化は令和7年9月の第一子無償化に包含され、区の資料では第2子固有の軽減規定として現れない。"
      },
      "thirdChildOnwards": {
        "value": 0,
        "unit": "JPY/month",
        "label": "第3子以降の保育料",
        "sourceId": "nerima-annai-r8",
        "checkedAt": "2026-07-17",
        "amendmentNote": "なし(2026-07-17時点)",
        "note": "第一子を含む全児童が無償のため0円。"
      }
    },
    "localExtension": "令和7年9月以降、第一子の保育料も無償化され、練馬区にお住まいのすべての児童の保育料が無料(原典表記、令和8年度「保育利用のご案内」P.4「第一子保育料の無償化が始まりました」)。東京都の第1子保育料無償化に対応するもので、東京都の第2子無償化(令和5年10月開始)はこれに包含される。区独自の上乗せとしては、幼児教育・保育無償化以降の3〜5歳児クラスの副食費が原則実費負担となった中で、練馬区が子どもたちの食育の推進と子育て世帯の負担軽減のため、練馬区に住所を有する世帯の給食費(主食費・副食費)を全額区費で賄い全階層無償としている点が該当する(そのため国基準の副食費徴収免除者に対する法令に定めた通知は省略)。ただし東京都外から通園する児童は保育料が発生する可能性がある。"
  },
  "tiers": [
    {
      "tier": "全階層(区分なし)",
      "label": "練馬区在住の全児童。令和7年9月以降、所得階層にかかわらず基本保育料は無料。練馬区は所得階層別の保育料表を公表していない(「保育料表」ページは削除済み)。",
      "incomeMin": 0,
      "incomeMax": null,
      "fees": {
        "under3": {
          "standard": 0,
          "short": 0
        },
        "age3plus": {
          "standard": 0,
          "short": 0
        }
      }
    }
  ],
  "verify": {
    "sourceId": "nerima-hoikuryo-page",
    "expect": [
      "令和7年9月以降、すべての児童の基本保育料が無料になります"
    ]
  }
}
