{
  "$schema": "../../schema/hoikuryo.schema.json",
  "id": "tokyo-minato",
  "name": "東京都港区",
  "municipalityCode": "131032",
  "prefecture": "東京都",
  "municipalityType": "特別区",
  "fiscalYear": 2026,
  "asOf": "2026-07-17",
  "sources": [
    {
      "id": "minato-hoikuryo-page",
      "title": "保育料・給食費",
      "publisher": "港区 子ども家庭支援部保育課保育支援係",
      "url": "https://www.city.minato.tokyo.jp/kodomo/kodomo/kodomo/hoikuen/27hoikuryo.html",
      "contentType": "html",
      "checkedAt": "2026-07-17",
      "tier": "municipality",
      "note": "更新日2025年10月3日、ページID46874。「港区では令和２年度から、最年長の子どもを第１子とし、第２子以降の基本保育料を無償としています。この度、東京都による第１子保育料無償化の方針を受け、令和７年９月から、第１子の基本保育料等も無償化します。」と明記。「５ 令和７年８月分までの保育料について」の節から旧「保育料（利用者負担額）」PDFにリンクしており、当該PDFの階層別金額が令和7年8月分までの過去の値であることが本文から明示される。"
    },
    {
      "id": "minato-annai-r8",
      "title": "令和8年度保育園入園のごあんない",
      "publisher": "港区 子ども家庭支援部保育課保育支援係",
      "url": "https://www.city.minato.tokyo.jp/documents/171277/goannnai08.pdf",
      "landingUrl": "https://www.city.minato.tokyo.jp/hoikusien/r8goannnai.html",
      "contentType": "pdf",
      "checkedAt": "2026-07-17",
      "tier": "municipality",
      "note": "全44ページ、令和7年10月発行の令和8年度版。P.24「11 保育料」に「【基本保育料】認可保育園、認定こども園及び港区保育室に通うお子さんの基本保育料は無償です。」「(2) 給食費 ０円」。所得階層別の基本保育料表の掲載は一切なく、階層区分はP.25の延長保育料金表(Ａ・Ｂ・Ｃの3階層)のみ。P.3に令和8年度クラス年齢表(令和8年4月1日現在の年齢)。"
    },
    {
      "id": "minato-kyu-hoikuryo-pdf",
      "title": "保育料（利用者負担額）",
      "publisher": "港区 子ども家庭支援部保育課保育支援係",
      "url": "https://www.city.minato.tokyo.jp/documents/46874/r5hoikuryou_riyoushahutangaku_1.pdf",
      "landingUrl": "https://www.city.minato.tokyo.jp/kodomo/kodomo/kodomo/hoikuen/27hoikuryo.html",
      "contentType": "pdf",
      "checkedAt": "2026-07-17",
      "tier": "municipality",
      "note": "★過去の値★ 「保育料・給食費」ページの「５ 令和７年８月分までの保育料について」の節にのみリンクされている旧階層表(Ａ・Ｂ・Ｃ１〜Ｃ３・Ｄ１〜Ｄ３０の34階層。0〜2歳児クラスは保育標準時間1,800円〜83,800円、3〜5歳児クラスは全階層0円)。令和7年9月の第1子無償化により基本保育料は全階層0円になったため、この金額は令和8年度の保育料としては無効。本ファイルの tiers には転用していない。"
    }
  ],
  "amendments": [
    {
      "summary": "令和7年9月より、東京都の第1子保育料無償化の方針を受けて港区は第1子の基本保育料等も無償化(区立及び私立認可保育園、認定こども園、小規模保育事業、居宅訪問型保育事業、港区保育室)。港区は令和2年度から既に第2子以降の基本保育料を無償としていた。2026-07-17時点で有効。",
      "status": "in-force",
      "effectiveFrom": "2025-09-01",
      "sourceId": "minato-hoikuryo-page",
      "impact": "全所得帯の基本保育料は0円。延長保育料は令和7年9月以降も変わらず利用に応じて徴収される(階層Ａ・Ｂ・Ｃ)ため、階層判定ロジック自体は引き続き必要。"
    },
    {
      "summary": "第1子無償化に伴い、港区は基本保育料の所得階層別金額表(Ａ・Ｂ・Ｃ１〜Ｃ３・Ｄ１〜Ｄ３０)を令和7年8月分までのものとして過去情報の節に退避し、令和8年度の公表資料(「令和8年度保育園入園のごあんない」全44ページ)には掲載していない。あわせて令和7年9月分から延長保育料の階層表を旧34階層から3階層(Ａ／Ｂ=所得割課税額20万円未満／Ｃ=20万円以上)に統合した(利用料金に変更なし)。令和8年度に有効な基本保育料の階層区分は2026-07-17時点で公表資料から取得不能。",
      "status": "under-review",
      "sourceId": "minato-annai-r8",
      "impact": "tiers は所得階層で区分できず、全所得帯を1行(0円)で表現している。推測での階層補完は行っていない(旧Ｄ３０までの境界額は令和7年8月分までの値であり、令和8年度の階層としては使用できない)。区が階層表を再公表した場合、または有料に戻る場合は要更新。"
    }
  ],
  "disclaimer": "本データは港区公式サイトおよび「令和8年度保育園入園のごあんない」の公表内容を2026-07-17時点で機械的に整理したものです。港区は令和7年9月以降、認可保育園等の基本保育料を第1子を含め無償としており、令和8年度に有効な所得階層別の保育料表を公表していません。制度改正や個別事情により内容が異なる場合がありますので、必ず港区保育課保育支援係または各地区総合支所区民課保健福祉係にご確認ください。",
  "scope": {
    "includes": [
      "区立・私立認可保育園の基本保育料",
      "認定こども園(2・3号認定)の基本保育料",
      "小規模保育事業・居宅訪問型保育事業の基本保育料",
      "港区保育室(区が設置する認可外保育施設。申込み方法・保育料・保育内容は認可保育園と同様)の基本保育料"
    ],
    "excludes": [
      "給食費 ※港区では認可保育園・小規模保育事業所・認定こども園・港区保育室に通う児童の給食費は0円(3〜5歳児クラスは月極の給食費を徴収せず、0〜2歳児クラスは基本保育料に含まれる給食費相当額を所得階層に応じて減額)。本表の対象外。私立保育園の給食費は異なる場合がある",
      "延長保育料 ※無償化の対象外。区立認可保育園・港区保育室・区立認定こども園(2・3号認定)は18時15分以降1時間単位で階層別(7時15分〜19時15分: Ａ=0円／Ｂ=200円・月額上限2,000円／Ｃ=400円・月額上限4,000円)、19時15分〜22時は Ａ=200円／Ｂ=400円／Ｃ=600円。私立認可保育園・地域型保育事業は各施設の設定額。待機児童向け居宅訪問型保育事業は1時間あたり1,000円",
      "早朝保育料(神明保育園のみ。6時15分〜7時15分、日額200円〜600円。階層区分により異なる)",
      "教材費・行事費等の実費徴収、私立園の上乗せ徴収・特定負担額",
      "認証保育所・認可外保育施設・幼稚園の保育料 ※認証保育所は月220時間(短時間認定は月160時間)までの月ぎめ契約の基本保育料を全額支給、認可外保育施設は10万円又は当該認可外保育施設保育料のいずれか低い額を支給する助成制度がある",
      "港区外に在住で区内認可保育園等を利用する児童の保育料(居住自治体の制度による)"
    ]
  },
  "bracketBasis": {
    "basis": "市町村民税所得割額",
    "householdScope": "未確認: 基本保育料が無償化されたため、令和8年度の公表資料に基本保育料の階層決定における合算対象世帯範囲の規定がない。参考として、延長保育料の階層は原典表記で「住民税課税額のうち、父母の区市町村民税所得割課税額の合計額で延長保育料の算定を行います。」「父母以外の扶養義務者の区市町村民税額の合計額が、その同居世帯の区市町村民税額の合計額の５割以上を占めている場合は、父母以外の区市町村民税額も算定対象となります。」とされている(祖父母等、同居者が生計中心者の場合はその方についても住民税情報が必要)。",
    "taxYearRule": "毎年9月に保育料の算定基礎となる区民税の年度を切り替える。原典が示す表は令和7年度の例で、「令和７年4月～令和７年8月分＝令和６年度分の区市町村民税額」「令和７年9月～令和８年3月分＝令和７年度分の区市町村民税額」。この規則によれば令和8年度は4〜8月分が令和7年度分、9月〜令和9年3月分が令和8年度分の区市町村民税額となるが、令和8年度を明示した表は2026-07-17時点で公表資料に見当たらない(未確認)。住民税の申告がない方や港区に転入した方等で税情報が確認できず書類の提出がない場合は最高階層となる。育児休業中で収入がない方も住民税の申告が必要。課税証明書が取得できない方(海外収入のある方や大使館職員等)は年間の収入額から算出する。",
    "deductionsIgnored": [
      "配当控除",
      "住宅借入金等特別税額控除",
      "寄附金税額控除",
      "外国税額控除",
      "配当割・株譲渡割額控除"
    ],
    "note": "★重要★ 港区は令和8年度に有効な基本保育料の階層表(所得割額の境界)を公表していない。令和8年度の資料で公表している階層区分は延長保育料用の3階層のみで、その原典表記は Ａ=「生活保護法による被保護世帯（単給世帯を含む。）及び中国残留邦人等の円滑な帰国の促進並びに永住帰国した中国残留邦人等及び特定配偶者の自立の支援に関する法律による支援給付を受けている者の属する世帯」および「Ａ階層を除き当年度分の区市町村民税非課税世帯」／Ｂ=「当年度分の区市町村民税のうち所得割課税額が200,000円未満である世帯」(区民税均等割のみ課税世帯を含む)／Ｃ=「当年度分の区市町村民税のうち所得割課税額が200,000円以上である世帯」。区は令和7年9月分からこの3階層に統合しており、旧階層との対応(Ａ・Ｂ→Ａ、Ｃ１〜Ｄ６→Ｂ、Ｄ７〜Ｄ３０→Ｃ)を「保育料・給食費」ページに掲載している。deductionsIgnored およびここに述べる所得割額の定義は、この延長保育料用の規定に基づく。所得割額の定義(原典表記): 「税額控除前の区市町村民税所得割課税額から調整控除及び定額減税額を引いた額が、算定に使用する区市町村民税所得割課税額です。」「調整控除及び定額減税以外の税額控除（配当控除、住宅借入金等特別税額控除、寄附金税額控除、外国税額控除、配当割・株譲渡割額控除）は適用しません。」★注意★ 港区は川崎市と同様に定額減税を適用後(減税額を差し引いた後)の金額で算定する点が、足し戻しのみを行う中央区等と異なる。所得割額の前処理について: 港区は特別区であり、政令指定都市のような税率調整(6/8換算等)は不要。★旧階層表の扱い★ 令和7年8月分までの基本保育料の階層表(Ａ・Ｂ・Ｃ１〜Ｃ３・Ｄ１〜Ｄ３０)は「保育料（利用者負担額）」PDFに残っているが、区の本文が「令和７年８月分までの保育料」と明示しているため、令和8年度の階層としては使用できず tiers に転用していない。ひとり親世帯・在宅障害児者のいる世帯について区市町村民税所得割課税額が77,101円未満の世帯の保育料を無料とする軽減が旧制度に存在したが、令和8年度の公表資料には第1子無償化に包含されて記載がない(未確認)。"
  },
  "ageClasses": [
    {
      "key": "under3",
      "label": "0〜2歳児クラス",
      "rule": "令和8年(2026年)4月1日現在の年齢で、利用する施設のクラスが決まる(令和8年度クラス年齢表)。年度途中で誕生日を迎えてもその年度中のクラスは変わらない(例: 令和7年4月6日生まれは1歳の誕生日を迎えても令和8年度中は0歳児クラス)。基本保育料は無償化により0円。0〜2歳児クラスは給食費相当額が基本保育料に含まれる建付けだが、基本保育料が0円のため負担は生じない。"
    },
    {
      "key": "age3plus",
      "label": "3〜5歳児クラス",
      "rule": "令和8年(2026年)4月1日現在の年齢で決まる。国の幼児教育・保育の無償化により従前から無料。月極の給食費も徴収しない。"
    }
  ],
  "freeTuition": {
    "age3plusFree": {
      "value": true,
      "unit": "unit",
      "label": "3歳以上児の基本保育料は無償",
      "sourceId": "minato-annai-r8",
      "checkedAt": "2026-07-17",
      "verify": {
        "expect": [
          "認可保育園、認定こども園及び港区保育室に通うお子さんの基本保育料は無償です"
        ]
      },
      "amendmentNote": "なし(2026-07-17時点)",
      "note": "国の幼児教育・保育の無償化に加え、港区の第2子以降無償化(令和2年度〜)および第1子無償化(令和7年9月〜)により0円。"
    },
    "under3NonTaxableFree": {
      "value": true,
      "unit": "unit",
      "label": "3歳未満の住民税非課税世帯も無償",
      "sourceId": "minato-hoikuryo-page",
      "checkedAt": "2026-07-17",
      "verify": {
        "expect": [
          "令和７年９月から、第１子の基本保育料等も無償化"
        ]
      },
      "amendmentNote": "なし(2026-07-17時点)",
      "note": "非課税世帯に限らず、令和7年9月以降は所得階層によらず0〜2歳児クラスの基本保育料も0円(旧階層表ではＡ・Ｂ階層が0円、Ｃ１階層が保育標準時間1,800円だった)。"
    },
    "multiChildPolicy": {
      "countingRule": {
        "value": "最年長の子どもを第1子として数える(港区民で、保護者と生計を一にする子。小学生等を含む)。",
        "unit": "unit",
        "label": "多子カウントの数え方(令和2年度からの第2子以降無償化の規定)",
        "sourceId": "minato-hoikuryo-page",
        "checkedAt": "2026-07-17",
        "verify": {
          "expect": [
            "最年長の子どもを第１子とし、第２子以降の基本保育料を無償"
          ]
        },
        "amendmentNote": "なし(2026-07-17時点)",
        "note": "未確認(年齢上限): 原典「港区では令和２年度から、最年長の子どもを第１子とし、第２子以降の基本保育料を無償としています。」により、国基準のような「小学校就学前の子のみ」といった年齢上限を設けていないことが読み取れるが、令和8年度の公表資料に数える対象の範囲(生計を一にする子の年齢上限、別居の子の扱い)を明示した規定はない。令和7年9月の第1子無償化により多子カウント自体が保育料の決定に不要となったため、区は詳細を公表していない。"
      },
      "secondChild": {
        "value": 0,
        "unit": "JPY/month",
        "label": "第2子の基本保育料",
        "sourceId": "minato-hoikuryo-page",
        "checkedAt": "2026-07-17",
        "amendmentNote": "なし(2026-07-17時点)",
        "note": "港区は令和2年度から区独自に第2子以降の基本保育料を無償としており、令和7年9月の第1子無償化以降は第1子も含め0円。"
      },
      "thirdChildOnwards": {
        "value": 0,
        "unit": "JPY/month",
        "label": "第3子以降の基本保育料",
        "sourceId": "minato-hoikuryo-page",
        "checkedAt": "2026-07-17",
        "amendmentNote": "なし(2026-07-17時点)",
        "note": "第1子を含む全児童が無償のため0円。"
      }
    },
    "localExtension": "港区は令和2年度から区独自に、最年長の子どもを第1子として数え、第2子以降の基本保育料を無償としてきた(東京都の第2子無償化(令和5年10月開始)に先行)。加えて令和7年9月から、東京都による第1子保育料無償化の方針を受けて第1子の基本保育料等も無償化し、区立及び私立認可保育園・認定こども園・小規模保育事業・居宅訪問型保育事業・港区保育室が対象となった。区独自の上乗せとしては、(1) 認可外である認証保育所についても月220時間(短時間認定の場合は月160時間)までの月ぎめ契約の基本保育料を全額支給し、認可外保育施設についても10万円又は当該認可外保育施設保育料のいずれか低い額を支給している点、(2) 令和5年9月分から給食費の保護者負担を軽減し、3〜5歳児クラスは月極の給食費を徴収せず、0〜2歳児クラスは基本保育料に含まれる給食費相当額を所得階層に応じて減額している点が該当する。延長保育料・早朝保育料は令和7年9月以降も変わらず利用に応じて徴収する。港区外に在住の場合の保育料は居住自治体の制度による。"
  },
  "tiers": [
    {
      "tier": "全階層(区分なし)",
      "label": "港区の認可保育園、認定こども園及び港区保育室に通うお子さんの基本保育料は無償(所得階層によらず0円)。港区は令和8年度に有効な基本保育料の所得階層別金額表を公表していない(公表されている階層表は令和7年8月分までのもの、および延長保育料用のＡ・Ｂ・Ｃの3階層のみ)。",
      "incomeMin": 0,
      "incomeMax": null,
      "fees": {
        "under3": {
          "standard": 0,
          "short": 0
        },
        "age3plus": {
          "standard": 0,
          "short": 0
        }
      }
    }
  ],
  "verify": {
    "sourceId": "minato-annai-r8",
    "expect": [
      "認可保育園、認定こども園及び港区保育室に通うお子さんの基本保育料は無償です"
    ]
  }
}
